nama_kelurahan,nama_tempat,type_tempat,rating_tempat,user_ratings_total,latitude,longitude,alamat_tempat
Jagakarsa,Area Berkah 99 Cuci Mobil & Kafe,cafe,4.7,3,-6.3278751,106.820492,"RT.2/RW.7, Jagakarsa"
Jagakarsa,Kopi tepian,cafe,5,1,-6.326819599999999,106.8203262,"Jalan Raya Jagakarsa No.10j, RT.5/RW.2, Jagakarsa"
Jagakarsa,Shalter team buser,cafe,0,0,-6.3267394,106.8203548,"Jalan Raya Jagakarsa No.10j, RT.5/RW.2, Jagakarsa"
Jagakarsa,Caffe NewPelangi,cafe,0,0,-6.326568099999999,106.8208324,"2, RT.2/RW.7, Jagakarsa"
Jagakarsa,PEMPEK DAN TEKWAN WONG KITO GALO,cafe,4.8,4,-6.326795100000001,106.8214517,"Jalan Raya Jagakarsa No.52b, RT.2/RW.7, Jagakarsa"
Jagakarsa,Shelter P-R-K JAKSEL,cafe,5,1,-6.326794800000001,106.8215141,"Jalan Raya Jagakarsa No.52A, RT.2/RW.7, Jagakarsa"
Jagakarsa,Angkringan Katresnan,cafe,5,3,-6.3268299,106.8215859,"Jalan Raya Jagakarsa No.49, RT.2/RW.7, Jagakarsa"
Jagakarsa,Teguk,cafe,4.8,57,-6.3267349,106.81954,"5, Jalan Raya Jagakarsa No.8A, RT.5/RW.2, Jagakarsa"
Jagakarsa,RDUS,cafe,0,0,-6.328673999999999,106.820724,"Jl. Aselih Blok A No.28, RT.10/RW.1, Jagakarsa"
Jagakarsa,Tentang Kita Jagakarsa,cafe,5,1,-6.3261571,106.8200452,"Jalan Pepaya Raya No.3, RT.2/RW.5, Jagakarsa"
Jagakarsa,"Warung ""Bunda""",cafe,4.8,4,-6.3286908,106.8207276,"Gang Swadaya RT.3/RW.7, Jagakarsa"
Jagakarsa,Es Cappucino Cincau Jagakarsa,cafe,5,1,-6.3260095,106.8201166,"Jalan Raya Jagakarsa No.4, RT.5/RW.2, Jagakarsa"
Jagakarsa,GORENGAN & Warkop Ari,cafe,5,2,-6.3266629,106.8194293,"Jalan Raya Jagakarsa No.8, RT.5/RW.2, Jagakarsa"
Jagakarsa,Warung Pintar Jagakarsa II-1,cafe,0,0,-6.3274211,106.8222886,"Jalan Raya Jagakarsa No.12, RT.1/RW.7, Jagakarsa"
Jagakarsa,HAUS! Jagakarsa Raya,cafe,4.4,97,-6.3264214,106.8195292,"Jalan Raya Jagakarsa No.6b, RT.5/RW.2, Jagakarsa"
Jagakarsa,Warkop Om Warjo Om 6 Jagakarsa,cafe,5,12,-6.3264214,106.8195291,"5, Jalan Raya Jagakarsa No.6b, RT.2/RW.2, Jagakarsa"
Jagakarsa,Warkop Prapto,cafe,4,1,-6.326734699999999,106.8221966,"Jalan Raya Jagakarsa RT.2/RW.7, Jagakarsa"
Jagakarsa,Cordon bleu cafe,cafe,4.5,4,-6.327305799999999,106.8223218,"Jalan Jagakarsa II No.27, RT.1/RW.7, Jagakarsa"
Jagakarsa,Warkop Berkah Big's Family,cafe,4.6,401,-6.3278705,106.822224,"Jalan Jagakarsa II No.60, RT.1/RW.7, Jagakarsa"
Jagakarsa,Jung Coffee Jagakarsa,cafe,4.7,33,-6.3266372,106.8192849,"Jalan Raya Jagakarsa RT.5/RW.2, Jagakarsa"
Jagakarsa,Bc pemburu gofood,cafe,0,0,-6.326677699999999,106.8191753,"Jalan Raya Jagakarsa No.8, RT.5/RW.2, Jagakarsa"
Jagakarsa,WARKOP KAMPOENG,cafe,5,18,-6.326702299999999,106.8223898,"samping pom bensin lama, Jalan Raya Jagakarsa No.5, RT.1/RW.7, Jagakarsa"
Jagakarsa,KBGB JAGKARSA,cafe,5,44,-6.327061199999999,106.8189274,"Jalan Raya Jagakarsa RT.2/RW.5, Jagakarsa"
Jagakarsa,Warkop Abadi,cafe,5,2,-6.327257099999999,106.8188759,"Jalan Raya Jagakarsa No.17, RT.2/RW.2, Jagakarsa"
Jagakarsa,Warkop Ghina,cafe,0,0,-6.3270745,106.8188858,"Jalan Raya Jagakarsa No.17j, RT.2/RW.2, Jagakarsa"
Jagakarsa,Warkop Budi Agen BRILink,cafe,4.3,43,-6.3270745,106.8188858,"Jalan Raya Jagakarsa No.17 J, RT.2/RW.2, Jagakarsa"
Jagakarsa,Warung Kopi Pak Aden,cafe,4.4,20,-6.3270145,106.8188637,"Jalan Raya Jagakarsa RT.2/RW.5, Jagakarsa"
Jagakarsa,Story Coffee,cafe,5,1,-6.327821399999999,106.8226747,"Jalan Raya Jagakarsa No.17, RT.1/RW.7, Jagakarsa"
Jagakarsa,Ngemil Yuuuuk By Alra Kitchen,cafe,5,3,-6.327821399999999,106.8226747,"Jalan Raya Jagakarsa No.17, RT.1/RW.7, Jagakarsa"
Jagakarsa,Kopi Kilat,cafe,5,4,-6.327042199999999,106.822756,"Di dalam SPBU 3412508, 1, Jalan Jagakarsa II No.4, RT.1/RW.7, Jagakarsa"
Jagakarsa,Meg's Grilled Cheese,cafe,4.7,84,-6.3258826,106.8222132,"Jalan Kecapi No.1, RT.9/RW.5, Jagakarsa"
Jagakarsa,warkop Bang Budi,cafe,5,3,-6.328047900000001,106.8188288,"Gang Aren I No.5, RT.5/RW.2, Jagakarsa"
Jagakarsa,Kedai 98 Jagakarsa,cafe,5,1,-6.327998399999999,106.8187785,"Gang Aren I RT.5/RW.2, Jagakarsa"
Jagakarsa,Warkop Sadaya Jangan Lupa Ngopi,cafe,5,5,-6.3275051,106.8185595,"Jalan Raya Jagakarsa RT.5/RW.2, Jagakarsa"
Jagakarsa,warkop gojek CeJe,cafe,5,2,-6.325611599999999,106.822422,"Blok Kecapi, Jalan Kecapi Blok Kecapi No.1, RT.9/RW.5, Jagakarsa"
Jagakarsa,Gasella's,cafe,4.3,9,-6.325291,106.8194937,"Jalan Pepaya Raya No.8, RT.8C/RW.5, Jagakarsa"
Jagakarsa,"BAKUL ES TEH POCI BUNDA, JAGAKARSA",cafe,5,4,-6.3297588,106.8208224,"3, Jalan Jagakarsa 1 No.13 B, RT.3/RW.7, Jagakarsa"
Jagakarsa,Rumah RFL,cafe,0,0,-6.329722,106.820181,"Jalan Jagakarsa 1 No.10 B, RT.4/RW.2, Jagakarsa"
Jagakarsa,Pusat Jajan,cafe,4,1,-6.3266763,106.8232595,"13, RT.13/RW.5, Jagakarsa"
Jagakarsa,Toko Kue Bu Anie,cafe,5,2,-6.328646900000001,106.8185482,"Jalan Aren III No.96, RT.5/RW.2, Jagakarsa"
Lenteng Agung,Ceker_inc.,restaurant,5,2,-6.3309525,106.8289915,"JL. Jagakarsa (Ubin), Lenteng Agung, RT.13/RW.1, Jagakarsa"
Lenteng Agung,Boloo 2 Fast Food,restaurant,4.3,423,-6.3273457,106.8239146,"Jalan Jagakarsa 1 No.58, RT.9/RW.7, Jagakarsa"
Lenteng Agung,Ochicken Kelapa 3,restaurant,4.3,8,-6.3267745,106.8294332,"Jalan Kelapa 3 Blok Haji Amat No.16, RT.5/RW.3, Jagakarsa"
Lenteng Agung,Ayam Bakar Lenteng Agung,restaurant,4.3,31,-6.330333699999999,106.8329388,"Jalan Raya Jagakarsa No.26, RT.6/RW.6, Lenteng Agung"
Lenteng Agung,WarNer - Waroeng Container LA,restaurant,4.4,85,-6.3270659,106.8401526,"Jalan Agung Raya II Gg. H. Saibi II No.103, RT.1/RW.4, Lenteng Agung"
Lenteng Agung,McDonald's,restaurant,4.5,6242,-6.331515899999999,106.8358599,"Jalan Raya Lenteng Agung No.12, RW.7, Lenteng Agung"
Lenteng Agung,Star5pizza,restaurant,0,0,-6.330627699999999,106.8291888,"Jalan Raya Jagakarsa RT.4/RW.6, Lenteng Agung"
Lenteng Agung,Kebab Turki Baba Rafi Lenteng Agung Barat S07,restaurant,5,2,-6.333327199999999,106.8350949,"Jalan Raya Lenteng Agung Gang Cemara No.9, RT.3/RW.10, Srengseng Sawah"
Lenteng Agung,Es Teler 77,restaurant,3.9,78,-6.3180312,106.8368973,"Jalan Lenteng Agung Raya No.8, RT.6/RW.1, Lenteng Agung"
Lenteng Agung,Kebab Baba Rafi,restaurant,4.3,8,-6.327896799999999,106.8239973,"Jalan Raya Jagakarsa No.49, RT.9/RW.7, Jagakarsa"
Lenteng Agung,DULDOT PUDDING,restaurant,4.3,8,-6.314851099999999,106.8339579,"Gang Ikhlas No.56, RT.3/RW.8, Kebagusan"
Lenteng Agung,nindy cookies,restaurant,4.8,12,-6.3168025,106.8269708,"Jl. Kebagusan IV gg. Haji lahir nomor 65 B, RT.5/RW.4, Kebagusan"
Lenteng Agung,MacaroniMia,restaurant,4,2,-6.322865999999999,106.821262,"Jalan Kecapi No.66, RT.1/RW.5, Jagakarsa"
Lenteng Agung,Mie Ayam Bakso Pangsit,restaurant,5,1,-6.3223289,106.8212219,"Jalan Kecapi No.31, RT.1/RW.5, Jagakarsa"
Lenteng Agung,Baso Putra Lawu,restaurant,0,0,-6.314731600000001,106.8428182,"Jalan Tanjung Barat Selatan RT.2/RW.2, Lenteng Agung"
Lenteng Agung,RM Kurnia Padang,restaurant,3.7,7,-6.326652999999999,106.8202182,"Jalan Raya Jagakarsa No.5C, RT.5/RW.2, Jagakarsa"
Lenteng Agung,Let's Go Chicken,restaurant,4.4,14,-6.326661000000001,106.8200342,"Jalan Raya Jagakarsa No.5, RT.5/RW.2, Jagakarsa"
Lenteng Agung,Siomay Aisha,restaurant,0,0,-6.336701,106.8253412,"Jalan Moch. Kahfi II Blok Setia Budi No.2, RT.11/RW.8, Srengseng Sawah"
Lenteng Agung,Kebab Turki Babarafi Desa Putra,restaurant,3.8,8,-6.338906499999998,106.8285659,"6째20'27. 106째49'39.2""E, Jalan Mawar Merah VII Blok 2 No.128, RT.7/RW.5, Malaka Jaya"
Lenteng Agung,Saung TRIBUANA V,restaurant,4.2,117,-6.3216607,106.8483298,"Jalan RA. Fadillah No.22, RT.6/RW.4, Baru"
Lenteng Agung,Soto Betawi Haji Udin (H. Udin),restaurant,4.2,13,-6.329536,106.819847,"Gg. Aren 3 RT 004 RW 02 No. 62, Jagakarsa, RT.4/RW.2, Jagakarsa"
Lenteng Agung,Ayam Bakar Mpu Sendok,restaurant,0,0,-6.339577999999999,106.828673,"Jalan Desa Putra No.17, RT.8/RW.5, Srengseng Sawah"
Lenteng Agung,Warung Makan Soto Tengkleng dan Nasi Pecel Bu Yati,restaurant,4.7,12,-6.322028099999999,106.8186063,"Jalan Pepaya Raya No.36, RT.3/RW.5, Jagakarsa"
Lenteng Agung,Bakso Sehat Bakso Atom Kalisari,restaurant,4.2,201,-6.3270015,106.8501846,"Jalan Haji Hasan RT.2/RW.2, Kalisari"
Lenteng Agung,Kharisma Bahari,restaurant,4,1,-6.335359299999999,106.8211664,"Jalan Sirsak No.69, RT.10/RW.7, Jagakarsa"
Lenteng Agung,The Corners Coffee & Resto,restaurant,4,17,-6.328542100000001,106.8512301,"Jalan Haji Hasan No.35, RT.1/RW.1, Baru"
Lenteng Agung,Dapur Nana Hasanah,restaurant,4.7,15,-6.317487999999999,106.818017,"Jln sagu gg mushola 2 rt07/05 no 51 jagakarsa 12620, RT.7/RW.5, Jagakarsa"
Lenteng Agung,Bakso malang Langgeng 37,restaurant,5,2,-6.325502999999999,106.8341101,"RT.2/RW.3, Lenteng Agung"
Lenteng Agung,Lenteng agung,restaurant,0,0,-6.325502999999999,106.8341101,"MRFM+QJX, RT.2/RW.3, Lenteng Agung"
Lenteng Agung,Pondok Sate Cirebon Pak Kumis,restaurant,0,0,-6.325502999999999,106.8341101,"MRFM+QJX, RT.2/RW.3, Lenteng Agung"
Lenteng Agung,Warteg Manja,restaurant,4.3,26,-6.3254576,106.8342049,"Jalan Raya Lenteng Agung RT.3/RW.3, Lenteng Agung"
Lenteng Agung,Bale Coffee,restaurant,4.4,17,-6.325316900000002,106.8342541,"Jalan Raya Lenteng Agung No.216, RT.3/RW.3, Lenteng Agung"
Lenteng Agung,Bakso Bakar Dame,restaurant,5,9,-6.325088999999999,106.833563,"Gang Haji Meran Blok Waspada No.2, RT.10/RW.5, Lenteng Agung"
Lenteng Agung,Sabana Geprek Fried Chiken Gg.Waru,restaurant,0,0,-6.3247762,106.8342415,"Gang Waru No.10, RT.13/RW.5, Kebagusan"
Lenteng Agung,Sate Padang Saiyo Baru Padang Panjang,restaurant,3.7,3,-6.3263644,106.8340524,"Jalan Raya Lenteng Agung No.8-15, RT.10/RW.4, Lenteng Agung"
Lenteng Agung,WARUNG SAHRUL,restaurant,4.3,13,-6.326407,106.834212,"Jalan Jakaria No.25A, RT.2/RW.3, Lenteng Agung"
Lenteng Agung,Warkop Kangii,restaurant,0,0,-6.3246195,106.8338552,"Jalan Lenteng Agung RT.13/RW.5, Lenteng Agung"
Lenteng Agung,Soto Lamongan Boby Junior (Mbak Susi),restaurant,0,0,-6.324726500000001,106.8346687,"Jalan Raya Lenteng Agung No.12A, RT.2/RW.8, Lenteng Agung"
Lenteng Agung,Gado Gado Po Yani,restaurant,0,0,-6.3246026,106.8338368,"rw 05, Jalan Lenteng Agung Raya No.26 rt 13, RT.5/RW.1, Lenteng Agung"
Lenteng Agung,Kedai mak piah,restaurant,5,1,-6.325755200000001,106.8331632,"RT.7/RW.5, no.40, RT.7/RW.5, Lenteng Agung"
Lenteng Agung,Resto Ayam Gepuk pak Gembus lenteng Agung,restaurant,5,1,-6.324676599999999,106.834712,"Jalan Raya Lenteng Agung No.12, RT.3/RW.3"
Lenteng Agung,RAINBOW Steak & Shake,restaurant,4.2,136,-6.324592899999999,106.8346193,"Jalan Raya Lenteng Agung No.8, RT.3/RW.3, Lenteng Agung"
Lenteng Agung,Sushi Daun,restaurant,0,0,-6.326312700000001,106.8349298,"Jakarta Selatan, RT.2/RW.3, Lenteng Agung"
Lenteng Agung,Dapur Susi,restaurant,4.5,2,-6.3247768,106.8332464,"Gg. H. Meran Blok, Gang Haji Sa'atun No.23a, RT.11/RW.5, Lenteng Agung"
Lenteng Agung,Sushi Daun,restaurant,0,0,-6.326228100000001,106.8350881,"Jakarta Selatan, RT.2/RW.3, Lenteng Agung"
Lenteng Agung,Warung Sate Solo Pak Soleh,restaurant,5,3,-6.326711599999999,106.8338934,"Jalan Raya Lenteng Agung RT.1/RW.3, Lenteng Agung"
Lenteng Agung,Husein nur,restaurant,5,1,-6.3244286,106.8347501,"Jalan Raya Lenteng Agung No.9, RT.3/RW.3, Lenteng Agung"
Lenteng Agung,Bakmie Ayam Tukul,restaurant,5,1,-6.3262705,106.8330731,"Gang Haji Meran No.33, RT.7/RW.5, Lenteng Agung"
Lenteng Agung,Kedai Bang Ujang,restaurant,5,3,-6.326526099999999,106.834977,"1, Jalan H. Zakaria Blok Haji Zakaria No.90, RT.1/RW.3, Lenteng Agung"
Lenteng Agung,Kedai Hanata,restaurant,5,6,-6.3268226,106.8343052,"Jalan H. Zakaria No.23, RT.1/RW.3, Lenteng Agung"
Lenteng Agung,Sosis Bakar Zammi,restaurant,0,0,-6.3268399,106.8341671,"Jalan Raya Lenteng Agung No.17, RT.1/RW.3, Lenteng Agung"
Lenteng Agung,Nasi Goreng 7 Rasa,restaurant,0,0,-6.3244191,106.8349495,"Jalan Raya Lenteng Agung No.9, RT.3/RW.3, Lenteng Agung"
Lenteng Agung,Mie Ayam Bakso P.L.O,restaurant,4.5,209,-6.3243499,106.8349234,"Jalan Agung Raya I No. 3 B, Jagakarsa, RT.3/RW.3, Lenteng Agung"
Lenteng Agung,Bakso Unyil 02 cabang kampus iisip,restaurant,0,0,-6.3249785,106.8327936,"Gang Haji Sa'atun No.42, RT.11/RW.5, Lenteng Agung"
Lenteng Agung,Nasi uduk ketupat sayur Bu dahlia,restaurant,0,0,-6.325117199999999,106.8327258,"Jalan Lenteng Agung Raya Gang Haji Sa'atun RT.11/RW.5, Lenteng Agung"
Lenteng Agung,Mie ayam seblak wawah,restaurant,5,2,-6.3266293,106.8350978,"Jalan H. Zakaria No.83, RT.1/RW.3, Lenteng Agung"
Lenteng Agung,Outentikibun,restaurant,0,0,-6.324104699999999,106.8336849,"Gang Waspada I No.13, RT.11/RW.5, Lenteng Agung"
Lenteng Agung,11PM LENTENG AGUNG,restaurant,0,0,-6.326459900000001,106.8353151,"Jl. H. Zakaria III Rt.001/Rw.003 No.101, RT.1/RW.3, Lenteng Agung"
Lenteng Agung,Pecel Lele Portugal,restaurant,4.7,12,-6.324291300000001,106.8350421,"RT.3/RW.3, Lenteng Agung"
Lenteng Agung,WARKOP 98 LENTAG...,restaurant,5,1,-6.3239964,106.8342958,"Jalan Lenteng Agung Raya RT.13/RW.5, Lenteng Agung"
Lenteng Agung,WARKOP PANTAS,cafe,4.4,34,-6.3251272,106.8385209,"Jalan Lontar No.45, RT.8/RW.3, Lenteng Agung"
Lenteng Agung,Selter Grab Anak Kodok,cafe,5,1,-6.3309517,106.8331213,"Jalan Raya Jagakarsa RT.6/RW.6, Jagakarsa"
Lenteng Agung,WarNer - Waroeng Container LA,cafe,4.4,85,-6.3270659,106.8401526,"Jalan Agung Raya II Gg. H. Saibi II No.103, RT.1/RW.4, Lenteng Agung"
Lenteng Agung,Kelapa Hijau 99,cafe,4.7,24,-6.326436999999999,106.8259323,"Jalan Kelapa Hijau No.99, RT.11/RW.3, Jagakarsa"
Lenteng Agung,Seblak Smaput 12,cafe,4.5,36,-6.3336925,106.8332855,"Jalan Moch. Kahfi II No.24, RT.2/RW.1, Srengseng Sawah"
Lenteng Agung,Epikurian Unbreakable Coffee & Roastery,cafe,4.5,55,-6.3226584,106.8260257,"Jalan H. Abdul Karim No.24, RT.3/RW.3, Jagakarsa"
Lenteng Agung,Daddys Takoyaki PGC,cafe,4.9,8,-6.3180285,106.8285295,"Villa 22, RT.8/RW.11, Kebagusan"
Lenteng Agung,Rumah Regita Cahyani,cafe,2.5,2,-6.3156081,106.8337121,"RT.5/RW.8, Kebagusan"
Lenteng Agung,Shisha88 Kebagusan,cafe,3.8,4,-6.322930099999999,106.8244724,"No., Jalan Kebagusan Raya No.25, RT.13/RW.5, Jagakarsa"
Lenteng Agung,Warkop Bubur Kacang Ijo,cafe,3.7,3,-6.3337387,106.8279523,"Jalan Jeruk Raya RT.11/RW.1, Jagakarsa"
Lenteng Agung,Kopiman,cafe,4.6,8,-6.3360775,106.8345103,"Jalan Raya Lenteng Agung No.6, RT.5/RW.10, Srengseng Sawah"
Lenteng Agung,Studio Donat,cafe,4.5,11,-6.3308247,106.8244889,"RT14RW01 Jalan Rambutan no, RT.9/RW.7, Jagakarsa"
Lenteng Agung,Dhilovta Pitza,cafe,5,4,-6.318373500000001,106.8238858,"Blok Mangga, Jalan Mangga I Mangga No.38B, RT.10/RW.5, Jagakarsa"
Lenteng Agung,Tourism Industry (Hotel specialist),cafe,3,2,-6.336611500000001,106.8421218,"Jalan Radar Baru D No.3, RW.2, Kalisari"
Lenteng Agung,Saung TRIBUANA V,cafe,4.2,117,-6.3216607,106.8483298,"Jalan RA. Fadillah No.22, RT.6/RW.4, Baru"
Lenteng Agung,Kebab Arjuna,cafe,4.7,47,-6.3133702,106.8255757,"Gang Buntu Jalan Kebagusan Raya No.36, RT.6/RW.5, Kebagusan"
Lenteng Agung,MAKARONI SUE,cafe,4.8,5,-6.309411099999999,106.8270551,"Jalan Kebagusan Raya RT.9/RW.7, Kebagusan"
Lenteng Agung,Apriadi,cafe,0,0,-6.3254636,106.8342536,"Jalan Lontar RT.5/RW.3, Lenteng Agung"
Lenteng Agung,WARMINDO SARWADI,cafe,4.7,3,-6.325389899999999,106.8342569,"Jalan Agung Raya 1 Rt 03 Rw 03 Pangkalan Ojek Kelurahan Lenteng Agung, Jagakarsa, RT.3/RW.3, Lenteng Agung"
Lenteng Agung,Bale Coffee,cafe,4.4,17,-6.325316900000002,106.8342541,"Jalan Raya Lenteng Agung No.216, RT.3/RW.3, Lenteng Agung"
Lenteng Agung,Warkop Mother's Prayer,cafe,0,0,-6.3257807,106.8337497,"Jalan Raya Lenteng Agung Blok Senyem No.27, RT.2/RW.3, Lenteng Agung"
Lenteng Agung,FRESH JUICE 2020,cafe,0,0,-6.325917400000001,106.8348518,"Jalan Lontar No.38, RT.2/RW.3, Lenteng Agung"
Lenteng Agung,Kini Cheese Tea & Warung Pintar,cafe,5,1,-6.3252381,106.8351648,"Jalan Lontar No.26, RT.3/RW.3, Lenteng Agung"
Lenteng Agung,Warung seblak yamin,cafe,0,0,-6.325602399999999,106.832833,"Gang Haji Meran No.9, RT.10/RW.5, Lenteng Agung"
Lenteng Agung,Warkop Reza,cafe,0,0,-6.324440800000001,106.8348718,"Jalan Raya Lenteng Agung No.3 C, RT.3/RW.3, Lenteng Agung"
Lenteng Agung,Aqilla Snack & Ice,cafe,5,1,-6.3243749,106.8334836,"Gang Waspada I RT.11/RW.5, Lenteng Agung"
Lenteng Agung,Edy,cafe,0,0,-6.3243204,106.8349518,"Jalan Agung Raya 1 Rt 03 Rw 03 No 3C Kelurahan Lenteng Agung Jagakarsa, RT.3, RT.3/RW.3, Lenteng Agung"
Lenteng Agung,Thai tea Nyot nyot jalan agung raya I,cafe,0,0,-6.324468299999999,106.8353328,"Jalan Agung Raya I No.43, RT.3/RW.3, Lenteng Agung"
Lenteng Agung,Warung Pojok 16,cafe,5,3,-6.327129999999999,106.8343301,"Gang Haji Joko No.16, RT.1/RW.3, Lenteng Agung"
Lenteng Agung,Starbuka thai tea,cafe,5,4,-6.3260651,106.8325482,"Gang Haji Meran No.24, RT.9/RW.5, Lenteng Agung"
Lenteng Agung,Warkop 21,cafe,5,4,-6.323798099999999,106.8339371,"Gang Waspada I RT.14/RW.5, Lenteng Agung"
Lenteng Agung,warkop 21 tercintah,cafe,5,1,-6.323744799999999,106.8340487,"Blok Waspada 1, Jalan Lenteng Agung Blok Waspada 1 No.20A, RT.11/RW.5, Lenteng Agung"
Lenteng Agung,Corndog Kuy,cafe,4.7,12,-6.327022200000001,106.833172,"Jalan Lenteng Agung Gang Waspada I RT.11/RW.5, Lenteng Agung"
Lenteng Agung,Warkop Angsana,cafe,0,0,-6.3252997,106.8359925,"Jalan Lontar No.7, RT.5/RW.3, Lenteng Agung"
Lenteng Agung,Kedae Athor,cafe,5,2,-6.3273855,106.8343074,"Gg. H. Joko, RT 01/03.no.15, RT.1/RW.3, Lenteng Agung"
Lenteng Agung,Cafetra,cafe,0,0,-6.3270972,106.8353231,"Gang Haji Meran No.141, RT.6/RW.3, Lenteng Agung"
Lenteng Agung,WARKOP BERKAH,cafe,4.4,78,-6.327312999999999,106.833188,"Jalan Lenteng Agung Raya Gang H. Ali No.5, RT.5/RW.5, Lenteng Agung"
Lenteng Agung,Gi-Rang Coffee,cafe,0,0,-6.3272184,106.83297,"Jl. Raya Gang H. Ali No.16, RT.7/RW.5, Lenteng Agung"
Lenteng Agung,WARKOP KAMEUMEUT,cafe,0,0,-6.323479,106.834634,"Jalan Raya Lenteng Agung Gang Waspada 1 Rt 05 Rw 014 No 9 Lenteng Agung, Jagakars, RT.11/RW.5, Lenteng Agung"
Lenteng Agung,Donat Bu Ajat,cafe,5,4,-6.324864499999999,106.8320239,"Gang Haji Sa'atun No.30, RT.12/RW.5, Lenteng Agung"
Lenteng Agung,Cafe Bang Iyus,cafe,4.5,17,-6.327706000000001,106.8344918,"Gang Haji Joko RT.1/RW.3, Lenteng Agung"
Lenteng Agung,Booster Lenteng Agung,cafe,5,4,-6.326463899999999,106.8362028,"Zakaria, Gang Haji Meran No.118, RT.1/RW.3, Lenteng Agung"
Lenteng Agung,Warung mpo Yanah,cafe,5,1,-6.3233003,106.8335122,"Jl. Lenteng Agung Blok, Gang Waspada I No.50, RT.14/RW.5, Lenteng Agung"
Lenteng Agung,Dapurdewi19,cafe,5,2,-6.327150800000001,106.8324555,"RT.8/RW.5, Lenteng Agung"
Lenteng Agung,Pesona Coffee LA,cafe,0,0,-6.3232427,106.8347226,"Jalan Raya Lenteng Agung No.14, RT.10/RW.04, Lenteng Agung"
Lenteng Agung,Warkop Jantuk Galunggung,cafe,4.8,10,-6.326336799999999,106.8364992,"Jalan H. Zakaria Blok Ujung No.29, RT.7/RW.3, Lenteng Agung"
Lenteng Agung,WARUNG KEMBAR 212,cafe,5,1,-6.326099999999999,106.83663,"Jl. H. Zakaria Blok Zakariaya No.36, RT.5/RW.3, Lenteng Agung"
Lenteng Agung,Waroeng Mamah Rysma,cafe,0,0,-6.327413399999999,106.8322416,"Jalan Lenteng Agung Raya Gang H. Ali No.Blok, RT.5/RW.5, Lenteng Agung"
Lenteng Agung,Cafe Pak Iyus,cafe,3.7,10,-6.3273231,106.8361268,"Gang Haji Joko RT.6/RW.3, Lenteng Agung"
Lenteng Agung,Cafe ngemil,cafe,5,1,-6.3279796,106.8327349,"Gang Haji Meran Blok Mesjid No.37, RT.5/RW.5, Lenteng Agung"
Lenteng Agung,kedai al faqih,cafe,0,0,-6.3226125,106.8345499,"Jalan Lenteng Agung Raya RT.11/RW.5, Lenteng Agung"
Lenteng Agung,Rumah Bang Ganteng,cafe,5,1,-6.322577099999999,106.8341764,"Gang Kampus No.25, RT.11/RW.1, Lenteng Agung"
Lenteng Agung,Warkop angsana,cafe,4.2,5,-6.325707599999999,106.8371845,"Jl. Lontar Blok Kariaya No.7, RT.8/RW.3, Lenteng Agung"
Lenteng Agung,KAMPUNG IISIP,cafe,5,1,-6.322445900000001,106.8346224,"MRHM+2RH, RT.8/RW.1, Lenteng Agung"
Lenteng Agung,warkop sari rasa(bp ade*bp aceng),cafe,4,4,-6.3225976,106.8352188,"No., Jalan Raya Lenteng Agung No.217, RT.8/RW.1, Lenteng Agung"
Lenteng Agung,KAMPUNG ANAK SWIIS,cafe,5,5,-6.3224049,106.8345211,"Jalan Lenteng Agung Blok Mushola No.32, RT.12/RW.1, Lenteng Agung"
Lenteng Agung,Hallu.in,cafe,4.8,6,-6.322479299999999,106.8352837,"Jalan Lenteng Agung Raya No.3 B, RT.8/RW.1, Lenteng Agung"
Lenteng Agung,Kedai isip,cafe,4.5,6,-6.322268,106.834906,"Jalan Lenteng Agung Mushola No.20, RT.8/RW.1, Lenteng Agung"
Lenteng Agung,CIKA CIKA,cafe,4.9,13,-6.3239844,106.8371584,"RT.9/RW.3, Lenteng Agung"
Lenteng Agung,Oncom Cafe,cafe,5,1,-6.3272178,106.8370779,"Jl. Raya Lenteng Agung Blok, Gang Haji Joko No.28, RT.7/RW.3, Lenteng Agung"
